<?xml version="1.0" encoding="UTF-8" ?>

<shop xmlns:xsi="http://www.w3.org/2001/XMLSchema-instance"
    xsi:noNamespaceSchemaLocation="shop_schema.xsd">

    <category name="games">
        <subcategory name="Consoles">
            <item>
                <company>Sony</company>
                <model>PS4</model>
                <date_production>2018-02-22</date_production>
                <color>Black</color>
                <price>700</price>
                <quantity>3</quantity>
            </item>
        </subcategory>

        <subcategory name="Portable">
            <item>
                <company>Nintendo</company>
                <model>SW100</model>
                <date_production>2019-02-07</date_production>
                <color>Purple-Blue</color>
                <price>600</price>
                <quantity>28</quantity>
            </item>
        </subcategory>
    </category>
    
</shop>
